PostId,Body
75903,The pigpio sonar ranger example html is not displaying for reasons I don't understand.However this is the code given in the example.
76982,"You can certainly read multiple bytes using read.The comments about FIFO are misleading, even though they are important to ensure high speed troughput, are inaccessable.The kernel drivers almost certainly provide buffering, but again this is inaccessable. (In the 1970s I wrote my own drivers which used a 256 character circular buffer.)The following code fragment is an example of how you could write such a buffered interface (into a user supplied buffer).This ia actually an add-on to a wiringPi library routine (AFAIK installed by default on the Raspbian) which I use to provide an equivalent to fgets. Similar code could be used with any library.The following is a test program"
78348,"This looks similar to what I did with a DHT11 temperature sensor with first a Raspberry Pi 3 and then with an Arduino.The Arduino code is at this URL: https://github.com/RichardChambers/anduino_uno/blob/master/project01/dht11_sensor.inoOne thing that I did was to write the DHT11 function, onewireReadDHT11() in my source code, so that I could collect statistics on how the read function was working. What I found was that the counter value check needed to be around 25 for a Raspberry Pi 3. However for an Arduino the comparison value was much less. You may need to increase that value to more than 30 for a Raspberry Pi.So an edited version of your read_dht11_dat() function with the if statement modified follows. The if statement checks the value of the variable counter which is really the width of the pulse received.One thing you can do is to print the actual data received out as hex values and check that if the dht11_dat[] data is all zeros or all ones."
79128,Using a char type to hold bytes is fairly common in C.  char is one of the basic C types and holds one byte.Here is some C code to read channel 0 of the MCP3008.  The example should make clear how the functions are used.
81747,
89185,"I was wrong (in comments) about the need for a function where you can delimit the number of bytes read yourself.  The way the I2C/SMBus protocol  block read is supposed to work is that the device indicates the amount of following data to be read in the first byte:This command reads a block of up to 32 bytes from a device, from a 
  designated register that is specified through the Comm byte. The amount
  of data is specified by the device in the Count byte.From: https://www.kernel.org/doc/Documentation/i2c/smbus-protocolThat's is taken care of in the implementation, and the first ""count byte"" is not part of the data.  Here's the definition of the native C userland function that most likely underlies the python library:You can see how the length of relevant data is used via data.block[0], which is the return value indicating the amount of data copied into the values buffer.  This is just a wrapper on the kernel interface, and although its not clear how much is actually read from the device, presumably it does accord with the count byte.It seems unlikely that the python wrapper messes that up.  So it is possibly the device itself which is at fault.  There's no way to tell looking at that code whether an error is passed up if the device gives a garbage value for the count, or whether the kernel then just limits the read to 32 bytes.  I'm inclined to believe the former, although that would mean the device said read 32 bytes, even though it is pretty clear from your output that only the first three or four are meaningful. "
92355,Here's a function called get_temp that returns the temperature in Farenheit or Celcius.Make a file called temp.c and compile it with gcc temp.c -o tempHere is temp.c:
99180,Finally I was able to find a solution. I used the example 2 from this post posted in Arduino forum https://forum.arduino.cc/index.php?topic=396450.0. I have edited python code also.Arduino codeEdited Python code:
